{
  "stage": "p01",
  "name": "Build & Static Quality",
  "status": "PASS",
  "commit": "de591708e8a3583327ae5e8e01410cd80207b899",
  "startedAt": "2026-08-31T05:49:30Z",
  "durationMs": 33008,
  "metrics": {"eslintErrors":0,"eslintWarnings":140,"typecheckExit":0},
  "blockers": [],
  "artifacts": ["artifacts/p01-eslint-raw.json","artifacts/p01-typecheck.txt"]
}
