{
  "stage": "p19",
  "name": "Contract Alignment",
  "status": "FAIL",
  "commit": "de591708e8a3583327ae5e8e01410cd80207b899",
  "startedAt": "2026-08-31T05:50:06Z",
  "durationMs": 183,
  "metrics": {"documentsChecked":6},
  "blockers": ["licence agreement does not state the one-time-fee model"],
  "artifacts": []
}
