{
  "stage": "p17",
  "name": "CPU Profile & Bundle Treemap",
  "status": "PASS",
  "commit": "d6809877861c2e45e7ba5ca893869582807efd72",
  "startedAt": "2026-09-03T04:12:50Z",
  "durationMs": 450,
  "metrics": {"jsBytes":8006439,"appJsBytes":2653804,"vendorJsBytes":5352635,"totalBytes":8549965},
  "blockers": [],
  "artifacts": ["artifacts/p17-bundle.json"]
}
