{
  "stage": "p18",
  "name": "Supply Chain Audit",
  "status": "NOT_VERIFIED",
  "commit": "d6809877861c2e45e7ba5ca893869582807efd72",
  "startedAt": "2026-09-03T04:13:27Z",
  "durationMs": 90,
  "metrics": {},
  "blockers": ["required tool not installed: osv-scanner (vulnerability scanner)"],
  "artifacts": []
}
